{
  "version": 1,
  "surface": "emacs-kbd",
  "source": "GNU Emacs Manual — Key Sequences / (kbd \"…\") (clean-room quarry; oracle: batch key-parse)",
  "vectors": [
    { "wire": "C-x", "chords": [{ "mods": "Control", "key": "X" }] },
    { "wire": "C-x C-f", "chords": [{ "mods": "Control", "key": "X" }, { "mods": "Control", "key": "F" }] },
    { "wire": "M-x", "chords": [{ "mods": "Alt", "key": "X" }] },
    { "wire": "C-M-x", "chords": [{ "mods": "Control|Alt", "key": "X" }] },
    { "wire": "RET", "plain": ["RET"] },
    { "wire": "M-RET", "chords": [{ "mods": "Alt", "key": "RET" }] },
    { "wire": "C-c C-c", "chords": [{ "mods": "Control", "key": "C" }, { "mods": "Control", "key": "C" }] },
    { "wire": "<C-x>", "chords": [{ "mods": "Control", "key": "X" }] }
  ]
}
